source_page,category,item_name,description,price
wines,Wines,,"The nose is spicy while the palate shows tones of mulberries, cherries and fynbos. The structure is broad with delicate tannins and a fresh aftermath",
wines,Wines,,"Penfolds Koonunga Hill Cabernet Sauvignon (Australia) 200 A bold, full-bodied wine displaying lovely aromatics, excellent structure and great length",
wines,Wines,,"A bold, full-bodied wine displaying lovely aromatics, excellent structure and great length",
wines,Wines,,"KWV Classic Collection Rosé (South Africa) 90 Fruit aromas of strawberries, rose petals and candy floss with hints of violets. The palate is elegant and fresh with an ester character and soft acidity",
wines,Wines,,"Fruit aromas of strawberries, rose petals and candy floss with hints of violets. The palate is elegant and fresh with an ester character and soft acidity",
wines,Wines,,"Nederburg Rosé (South Africa) 90 Sweet and delicate aromas of ripe cherries, strawberries and candy floss with a hint of spice and a refreshing flavour on the palate",
wines,Wines,,"Sweet and delicate aromas of ripe cherries, strawberries and candy floss with a hint of spice and a refreshing flavour on the palate",
wines,Wines,,"Exhib' Cap D'agde Rosé (France) 90 Pale-pink colour. Intense, fresh, beautiful notes of pink grapefruit. Fresh peach and citrus with an elegant, crisp, dry palate; packaged in a special, exhibitionist bottle",
wines,Wines,,"Pale-pink colour. Intense, fresh, beautiful notes of pink grapefruit. Fresh peach and citrus with an elegant, crisp, dry palate; packaged in a special, exhibitionist bottle",
cake,Cake,,"Carrot Cake 1KG - 120, 1.5KG - 170, 2KG - 200",
cake,Cake,,"Chocolate Cake 1KG - 120, 1.5KG - 170, 2KG - 200",
cake,Cake,,"Coconut Cake 1KG - 120, 1.5KG - 170, 2KG - 200",
cake,Cake,,"Fruit Cake 1KG - 140, 1.5KG - 180, 2KG - 220",
cake,Cake,,"Lemon Cake 1KG - 120, 1.5KG - 170, 2KG - 200",
cake,Cake,,"Strawberry Cake 1KG - 120, 1.5KG - 170, 2KG - 200",
cake,Cake,,"Vanilla Cake 1KG - 120, 1.5KG - 170, 2KG - 200",
cake,Cake,,"Vanilla Cheesecake 1KG - 160, 1.5KG - 220, 2KG - 260",
cake,Cake,,"Black Forest Cake 1KG - 120, 1.5KG - 170, 2KG - 200",
cake,Cake,,"White Forest Cake 1KG - 120, 1.5KG - 170, 2KG - 200",
cake,Cake,,"Chocolate Fudge Cake 1KG - 140, 1.5KG - 180, 2KG - 220",
cake,Cake,,"Red Velvet Cake 1KG - 120, 1.5KG - 170, 2KG - 200",
cake,Cake,,"White Chocolate Cake 1KG - 120, 1.5KG - 170, 2KG - 200",
events,Events,,The Hickory Restaurant Presents Cocktail O'clock. Serving up cocktails daily. For reservations call +256 758 809 187. ...,
events,Events,,The Hickory Restaurant Presents the Monthly Chef's Specials. We spend hours creating wonderful new recipes. The best ones become our monthly specials. Be sure to...,
events,Events,,The Hickory Restaurant Presents Cocktail O'clock. Serving up signature cocktails daily. For reservations call +256 758 809 187. ...,
contact,location_info,,"Plot 11 Ngabo Road, Kololo, Kampala, Uganda",
contact,location_info,,+256 758 809 187,
contact,location_info,,info@thehickorykampala.com,
contact,location_info,,www.thehickorykampala.com,
about,restaurant_description,The Hickory Kampala,The Hickory is an upscale restaurant and lounge located in Kololo Kampala Uganda known as The Woody Wine and Dine,
about,restaurant_description,The Hickory Kampala,The Hickory draws inspiration from the hickory tree symbolizing strength competence adventure and a spirit of fortitude,
about,restaurant_description,The Hickory Kampala,The hickory tree was historically used in wagon wheels tool handles and early aircraft construction representing durability and quality,
about,restaurant_description,The Hickory Kampala,The Hickory gained rapid popularity following its opening challenging established high-end establishments in Kampala,
about,restaurant_description,The Hickory Kampala,The restaurant offers international European fusion cuisine with signature dishes and an extensive cocktail and wine selection,
about,restaurant_description,The Hickory Kampala,The Hickory features contemporary stylish ambiance with both indoor and garden seating areas,
about,restaurant_description,The Hickory Kampala,The restaurant provides free Wi-Fi outdoor seating takeaway services and disabled access,
about,restaurant_description,The Hickory Kampala,The Hickory participates in Kampala Restaurant Week with special menus and incentives,
about,restaurant_description,The Hickory Kampala,The Hickory is known for its charming ambiance and garden-like setting particularly beautiful at night,
about,restaurant_description,The Hickory Kampala,Located at Plot 11 Ngabo Road Kololo Kampala Uganda the restaurant operates from 8am to 11pm everyday,
about,restaurant_description,The Hickory Kampala,The Hickory offers reservation services event hosting and catering for special occasions,
about,restaurant_description,The Hickory Kampala,The restaurant features a Monthly Chefs Specials program with rotating specialty dishes,
about,restaurant_description,The Hickory Kampala,Cocktail Oclock is a signature experience at The Hickory featuring their handcrafted cocktail menu,
about,restaurant_description,The Hickory Kampala,The Hickory maintains an active social media presence on Facebook Twitter Instagram and TripAdvisor,
about,restaurant_description,The Hickory Kampala,Contact The Hickory at phone number +256 758 809 187 or email info@thehickorykampala.com,
food,Starters and Soups,Cheese Croquettes,Mixed cheese cubes coated in breadcrumbs and lightly fried served as a vegetarian starter,26
food,Starters and Soups,Avocado Prawns,Base of lettuce prawns and avocado in cocktail sauce a fresh seafood appetizer,36
food,Starters and Soups,Chilli-garlic Prawns,Fresh shrimp pan-fried with chilli and garlic finished with lemon and herbs on toasted bread,36
food,Starters and Soups,Cashew Chicken,Stir-fried chicken with roasted cashew nuts in brown-garlic sauce an Asian-inspired starter,34
food,Starters and Soups,Barbeque Beef Meatballs,Ground beef with garlic coriander and onions baked and coated in barbeque sauce,35
food,Starters and Soups,Pumpkin Soup,Roasted spiced pumpkin soup with celery butter garlic and coriander a vegetarian option,25
food,Starters and Soups,Mongolian Beef Strips,Flank steak tossed in Mongolian sauce and sweet peppers an Asian-inspired appetizer,34
food,Starters and Soups,Hickory Barbeque Chicken Wings,Buffalo chicken wings with Asian condiments and spicy barbeque glaze,35
food,Starters and Soups,Frittura Di Calamari,Deep-fried calamari served with tartar sauce an Italian-style seafood starter,28
food,Starters and Soups,Tempura Prawns,Deep-fried butter-coated prawns with honey-mayonnaise glaze a Japanese-inspired dish,36
food,Starters and Soups,Bacon-wrapped Steak Bites,Beef fillet cubes wrapped in bacon baked and served with salad,30
food,Starters and Soups,Fresh Soup of The Day,Daily freshly prepared soup ask server for details,23
food,Starters and Soups,Bisquick Chicken Tenders,Crispy chicken breast strips coated in breadcrumbs served with sweet-chilli sauce,32
food,Starters and Soups,Wingstop Garlic-parmesan Wings,Chicken wings with garlic and Parmesan sauce a savoury appetizer,35
food,Salads,Hickory Organic Salad,Cucumber bell peppers olives tomatoes lettuce carrots onions with lemon and vinaigrette a vegetarian option,30
food,Salads,Greek Salad,Lettuce onions cucumber peppers tomatoes olives and feta cheese a classic Mediterranean vegetarian salad,38
food,Salads,Chicken Caesar Salad,Romaine lettuce anchovies croutons grilled chicken breast and Caesar dressing,40
food,Salads,Mixed Sea Food Salad,Salmon shrimp and calamari on lettuce with cherry tomatoes and cucumber,49
food,Salads,Cobb Salad,Grilled chicken breast avocado tomatoes eggs bacon cheddar cheese with shallot vinaigrette,44
food,Salads,Prawn Mango and Avocado Salad,Fresh lettuce tomatoes mango topped with herbed prawns and cocktail dressing,45
food,Curries,Thai Coconut Curry Vegetables,Fresh cilantro basil coriander and coconut milk with steamed vegetables served with rice vegetarian,40
food,Curries,Thai Coconut Curry Beef,Fresh cilantro basil coriander and coconut milk with beef fillet served with steamed rice,47
food,Curries,Thai Coconut Curry Chicken,Fresh cilantro basil coriander and coconut milk with chicken fillet served with steamed rice,49
food,Curries,Thai Coconut Curry Tilapia,Fresh cilantro basil coriander and coconut milk with tilapia fillet served with steamed rice,49
food,Curries,Thai Coconut Curry Salmon,Fresh cilantro basil coriander and coconut milk with salmon fillet served with steamed rice,62
food,Curries,Thai Green Curry Vegetables,Cilantro lemon grass galangal chillies and kaffir lime with steamed vegetables vegetarian,40
food,Curries,Thai Green Curry Beef,Cilantro lemon grass galangal chillies and kaffir lime with beef fillet served with rice,47
food,Curries,Thai Green Curry Chicken,Cilantro lemon grass galangal chillies and kaffir lime with chicken fillet served with rice,49
food,Curries,Thai Green Curry Tilapia,Cilantro lemon grass galangal chillies and kaffir lime with tilapia fillet served with rice,49
food,Curries,Thai Green Curry Salmon,Cilantro lemon grass galangal chillies and kaffir lime with salmon fillet served with rice,62
food,Curries,Thai Chilli-Basil Curry Vegetables,Garlic sweet peppers onions and basil with steamed vegetables vegetarian,40
food,Curries,Thai Chilli-Basil Curry Beef,Garlic sweet peppers onions and basil with beef fillet served with steamed rice,47
food,Curries,Thai Chilli-Basil Curry Chicken,Garlic sweet peppers onions and basil with chicken fillet served with steamed rice,49
food,Curries,Goat Curry,Boneless goat leg cubes in traditional curry sauce served with steamed rice a local favourite,50
food,Burgers,Classic Chicken Burger,Grilled free-range chicken patty with lettuce cheese onions tomatoes mayonnaise served with chips and salad,49
food,Burgers,Hickory Inspirational Beef Burger,Grilled beef patty with lettuce cheese onions tomatoes mayonnaise served with crispy chips and garden salad,49
food,Burgers,Lake Victoria Fish Burger,Crumbed tilapia fillet with tomatoes onion rings lettuce and Thousand Island dressing served with chips,47
food,Burgers,Vegetable Burger,Organic vegetables with caramelised French onions a vegetarian burger served with chips and salad,43
food,Burgers,Gourmet Italian Burger,Ground beef and pork blend with mozzarella cheese basil and marinara sauce served with chips,55
food,Butchers Choice,Beef Fillet Steak,Organic beef fillet with steamed vegetables and choice of Bearnaise mushroom peppercorn or Arrabbiata sauce with parsley potatoes,53
food,Butchers Choice,T-Bone Steak,500g marinated with thyme and garlic grilled and served with peppercorn sauce and potato wedges,70
food,Butchers Choice,Beef Fillet Steak In Gorgonzola Sauce,Grilled beef fillet with creamy gorgonzola sauce crispy bacon and grilled onion rings with lyonnaise potatoes,56
food,Butchers Choice,Bacon-Wrapped Beef Filet,Beef fillet wrapped in bacon stuffed with cheese and mushrooms served with creamy spinach mushroom sauce and lyonnaise potatoes,55
food,Pasta and Risotto,Philly Cheesesteak Pasta,Beef fillet strips with fusilli pasta bell peppers and gorgonzola cheese,50
food,Pasta and Risotto,Lasagne Al Forno,Traditional silky pasta sheets coated in Bolognese and bechamel topped with mozzarella and Grana Padano,50
food,Pasta and Risotto,Homemade Spaghetti Bolognese,Spaghetti in classic beef Bolognese sauce a traditional Italian favourite,47
food,Pasta and Risotto,Spaghetti Alla Carbonara,Pasta with crispy bacon cooking cream egg yolks and Parmesan cheese served with garlic bread,52
food,Pasta and Risotto,Tuscan Chicken Pasta,Penne pasta in creamy spinach sauce with chicken strips and sun-dried tomatoes topped with Grana Padano,50
food,Pasta and Risotto,Creamy Tomato Risotto With Meatballs,Italian rice in creamy tomato sauce with beef meatballs topped with Parmesan,53
food,Pasta and Risotto,Linguine Chicken-Bacon Alfredo,Classic Italian pasta in creamy garlic sauce with chicken breast chunks topped with bacon and Grana Padano,51
food,Pasta and Risotto,Risotto Ai Fruitti Di Mare,Risotto rice tossed with shrimp and calamari a seafood Italian classic,53
food,Pasta and Risotto,Risotto In Fresh Ugandan Vegetables,Traditional Italian rice tossed with steamed vegetables a vegetarian risotto,49
food,Pasta and Risotto,Penne Arrabbiata,Penne in spicy tomato sauce topped with basil and Parmesan a vegetarian pasta,45
food,Pasta and Risotto,Lasagne Alla Verdure,Pasta layered with Ugandan vegetables bechamel Parmesan and baked a vegetarian lasagne,46
food,Pasta and Risotto,Hickory Steak Pasta,Tomato and basil linguine topped with beef fillet steak and Grana Padano,50
food,Pasta and Risotto,Chicken and Coconut Tomato Pasta,Penne pasta with grilled chicken breast strips coconut cream and tomato sauce,50
food,Mains,Ugandan Organic Pork Chops,Grilled pork chops on creamy sukuma-wiki served with mushroom sauce and fried plantain a local Ugandan dish,54
food,Mains,Pork Ribs,Spiced pork ribs baked until golden-brown served with choice of barbeque pesto or mushroom sauce and fried plantain,57
food,Mains,Baked Nile Perch Fillet,Lake Victoria Nile perch marinated and baked on creamy spinach served with mushroom sauce and mashed potatoes,49
food,Mains,Tuscan Smothered Pork Chops,Juicy pork chops in homemade creamy Tuscan sauce served with fried plantain,56
food,Mains,Hickory Special Grilled Chicken Breast Stuffed With Spinach,Marinated chicken breast wrapped in bacon stuffed with spinach and mozzarella with mushroom sauce steamed vegetables and rice,50
food,Mains,Tilapia Florentine,Grilled tilapia fillet on creamy spinach with choice of tomato-cashew nut mushroom tomato-basil or coconut sauce with rice,53
food,Mains,Grilled Half In-Bone Chicken,Rosemary oregano and honey-marinated chicken served with mushroom sauce handpicked vegetables and crispy chips,52
food,Mains,Grilled Chicken Breast,Skinless chicken breast with choice of Puttanesca mushroom peanut coconut or Cioppino sauce with vegetable rice,50
food,Mains,Creamy Chicken Cordon Bleu,Breaded chicken breast stuffed with ham and cheese topped with Dijon sauce served with lyonnaise potatoes,52
food,Mains,Hickory Carnival Platter,Mixed grill of quarter chicken mini beef fillet steak chicken skewers and pork skewers with mushroom sauce and potato wedges,62
food,Mains,Fillet Of Salmon,Grilled Norwegian salmon fillet with steamed vegetables and tomato-cashew nut sauce served with vegetable rice,75
food,Mains,Jumbo Prawns,Grilled jumbo prawns marinated with garlic butter and lemon served with garden salad tartar sauce and crispy chips,72
food,Mains,Pan-Seared Tilapia On A Bed Of Pasta,Grilled tilapia fillet on linguine pasta in pesto sauce served with steamed vegetables,54
food,Mains,Chilli-Lime Steak Fajita,Beef fillet marinated with Moroccan spices in chilli-lime sauce served with avocado slices and mashed potatoes,56
food,Mains,Creamy Tuscan Salmon Fillet,Pan-seared Norwegian salmon fillet in homemade creamy Tuscan sauce served with risotto rice,79
food,Mains,Zippy Breaded Pork Chops,Boneless pork chops coated in breadcrumbs and deep-fried served with mushroom sauce and masala chips,56
food,Mains,Bacon-Wrapped Tilapia,Lake Victoria tilapia fillet wrapped in bacon and grilled served with white wine-caper sauce and mashed potatoes,55
food,Desserts,Organic Fruit Salad With Ice Cream,Fresh organic fruit salad served with scoops of ice cream a light and refreshing dessert,18
food,Desserts,Tiramisu,Classic Italian coffee-flavoured dessert made with layers of mascarpone and espresso-soaked ladyfingers,30
food,Desserts,Cake of The Day Slice,Daily selection of freshly baked cake ask your server for todays special flavour,22
food,Desserts,Creme Brulee,Classic French custard dessert with a caramelised sugar crust,25
food,Desserts,New York Cheesecake,Rich and creamy New York style cheesecake a classic American dessert,30
food,Desserts,Chocolate Fondant,Warm chocolate cake with a molten chocolate center a rich indulgent dessert,29
food,Desserts,Apple Crumble Tart,Baked apple tart with a buttery crumble topping served warm,30
food,Desserts,Scoops of Ice Cream,Two scoops of premium ice cream in your choice of flavour,15
food,Desserts,Nutty Caramel and Chocolate Sundae,Ice cream sundae with caramel nuts and chocolate sauce,22
food,Sauces,Tuscan sauce,Tuscan sauce available as an accompaniment to main dishes and steaks,10
food,Sauces,mushroom sauce,mushroom sauce available as an accompaniment to main dishes and steaks,10
food,Sauces,peppercorn sauce,peppercorn sauce available as an accompaniment to main dishes and steaks,10
food,Sauces,pesto sauce,pesto sauce available as an accompaniment to main dishes and steaks,10
food,Sauces,arrabbiata sauce,arrabbiata sauce available as an accompaniment to main dishes and steaks,10
food,Sauces,peanut sauce,peanut sauce available as an accompaniment to main dishes and steaks,10
food,Sauces,coconut sauce,coconut sauce available as an accompaniment to main dishes and steaks,10
food,Sauces,barbeque sauce,barbeque sauce available as an accompaniment to main dishes and steaks,10
food,Sauces,Dijon sauce,Dijon sauce available as an accompaniment to main dishes and steaks,10
food,Sauces,Puttanesca sauce,Puttanesca sauce available as an accompaniment to main dishes and steaks,10
food,Sauces,tartar sauce,tartar sauce available as an accompaniment to main dishes and steaks,10
food,Sauces,bearnaise sauce,bearnaise sauce available as an accompaniment to main dishes and steaks,10
food,Sauces,gorgonzola sauce,gorgonzola sauce available as an accompaniment to main dishes and steaks,10
food,Sauces,tomato-basil sauce,tomato-basil sauce available as an accompaniment to main dishes and steaks,10
food,Sauces,white wine-caper sauce,white wine-caper sauce available as an accompaniment to main dishes and steaks,10
food,Sauces,Cioppino sauce,Cioppino sauce available as an accompaniment to main dishes and steaks,10
food,Sauces,tomato-cashew nut sauce,tomato-cashew nut sauce available as an accompaniment to main dishes and steaks,10
food,Sauces,chilli-lime sauce,chilli-lime sauce available as an accompaniment to main dishes and steaks,10
food,Sides,Steamed vegetables,Steamed vegetables served as a side dish accompaniment to main courses,12
food,Sides,garden-fresh salad,garden-fresh salad served as a side dish accompaniment to main courses,12
food,Sides,crispy chips,crispy chips served as a side dish accompaniment to main courses,12
food,Sides,steamed rice,steamed rice served as a side dish accompaniment to main courses,12
food,Sides,vegetable rice,vegetable rice served as a side dish accompaniment to main courses,12
food,Sides,mashed potatoes,mashed potatoes served as a side dish accompaniment to main courses,12
food,Sides,potato wedges,potato wedges served as a side dish accompaniment to main courses,12
food,Sides,parsley potatoes,parsley potatoes served as a side dish accompaniment to main courses,12
food,Sides,avocado,avocado served as a side dish accompaniment to main courses,12
food,Sides,lyonnaise potatoes,lyonnaise potatoes served as a side dish accompaniment to main courses,12
food,Sides,masala chips,masala chips served as a side dish accompaniment to main courses,12
food,Sides,fried plantain,fried plantain served as a side dish accompaniment to main courses,12
food,Sides,creamy spinach,creamy spinach served as a side dish accompaniment to main courses,12
drinks,Coffees,Espresso Single,Single shot of espresso a classic Italian coffee,7
drinks,Coffees,Espresso Double,Double shot of espresso for a stronger coffee experience,10
drinks,Coffees,Cappuccino Single,Single shot cappuccino with steamed milk and foam,9
drinks,Coffees,Cappuccino Double,Double shot cappuccino with steamed milk and foam,12
drinks,Coffees,Mocha Latte,Espresso with chocolate and steamed milk a sweet coffee drink,12
drinks,Coffees,Macchiato,Espresso marked with a dollop of foamed milk,8
drinks,Coffees,Cafe Latte,Espresso with steamed milk smooth and creamy coffee,9
drinks,Coffees,Americano Single,Single espresso diluted with hot water a classic black coffee,8
drinks,Coffees,Americano Double,Double espresso diluted with hot water for a stronger black coffee,12
drinks,Coffees,Hot Chocolate,Rich creamy hot chocolate drink,12
drinks,Coffees,African Coffee,Traditional African-style brewed coffee with local spices,12
drinks,Teas,Black Tea Plain,Simple plain black tea served hot,8
drinks,Teas,Chai Latte,Spiced tea with steamed milk an aromatic warm drink,12
drinks,Teas,Black Tea Spiced,Black tea infused with traditional spices,8
drinks,Teas,African Tea Spiced,African-style spiced tea with local herbs and spices,9
drinks,Teas,Dawa Tea,Kenyan honey and lemon tea known for soothing and healing properties,14
drinks,Teas,Herbal Tea,Caffeine-free herbal infusion tea,12
drinks,Beers and Ciders,Local Beer,Ugandan locally brewed beer,8
drinks,Beers and Ciders,Local Cider,Ugandan locally produced cider,8
drinks,Beers and Ciders,Imported Cider,Premium imported cider,12
drinks,Beers and Ciders,Imported Beer,Premium imported beer,12
drinks,Cold Beverages,Fresh Juice,Freshly squeezed fruit juice,12
drinks,Cold Beverages,Soda,Soft drink carbonated beverage,4
drinks,Cold Beverages,Diet Coke,Sugar-free diet cola,5
drinks,Cold Beverages,Still Water,Still mineral water,4
drinks,Cold Beverages,Red Bull,Energy drink,12
drinks,Cold Beverages,Iced Coffee,Chilled coffee drink served over ice,15
drinks,Cold Beverages,Ice Tea,Chilled tea drink refreshing and light,10
drinks,Cold Beverages,Milkshake,Creamy blended milkshake in various flavours,18
drinks,Cold Beverages,Smoothie,Fresh fruit smoothie blended with ice,22
drinks,Cold Beverages,Sparkling Water,Carbonated sparkling mineral water,6
drinks,Cocktails,Appletini,Sweet refreshing martini drink in green apple flavour,24
drinks,Cocktails,Cosmopolitan,Equal part of vodka and triple sec plus fresh cranberry juice a classic cocktail,24
drinks,Cocktails,Dry Martini,Traditional aperitif cocktail best enjoyed before meals elegant and strong,24
drinks,Cocktails,Hickopolitan,Cosmopolitan variant with a minty twist a Hickory signature cocktail,24
drinks,Cocktails,Classic Margarita,Mexican tequila thirst-quencher with triple sec and freshly squeezed lime juice,26
drinks,Cocktails,Old Fashioned,Mix of sweet Merlot and Bourbon whiskey a timeless classic cocktail,35
drinks,Cocktails,Absolut Paradise,Raspberry-based cocktail infused with fresh berries fruity and refreshing,24
drinks,Cocktails,Rose and Basil,Gin-based cocktail with hints of rosemary and basil herbal and aromatic,24
drinks,Cocktails,Lady in Red,London gin with strawberry and grapes finishing a fruity gin cocktail,24
drinks,Cocktails,Red Sangria,Iced punch with fruit infusion and red wine a Spanish classic,25
drinks,Cocktails,White Sangria,Iced punch with fruit infusion and white wine refreshing,25
drinks,Cocktails,Whiskey Sour,Sweet and sour cocktail with pineapple texture made with whiskey,28
drinks,Cocktails,Cookie Monster,Baileys Irish cream freakshake with cookies and chocolate an indulgent dessert cocktail,23
drinks,Cocktails,Mojito,Cuban classic with rum mint sugar and lime juice refreshing and minty,22
drinks,Cocktails,Long Island Iced Tea,Multiple spirits mixed into a potent cocktail that looks like iced tea,30
drinks,Cocktails,Frosty Deep Pool,Five different spirits and red bull a strong and energizing cocktail,32
drinks,Cocktails,Bulago Island Breeze,Fruity punch with Uganda waragi pineapple a locally inspired tropical cocktail,25
drinks,Cocktails,Watermelon Smash,Vodka with whisky liqueur and fresh watermelon juice refreshing and fruity,24
drinks,Cocktails,Mai Tai,Quality rum infused in tropical fruit juice a Polynesian classic cocktail,24
drinks,Cocktails,Queen Slayer,Amarula chocolate sauce and spiced rum a sweet and creamy cocktail,24
drinks,Cocktails,Jumping Jack,Jack Daniels honey whiskey with ginger ale a smooth whiskey cocktail,24
drinks,Cocktails,Genie in a Goblet,Gin and tonic with mint liqueur and fresh mint a refreshing gin cocktail,24
drinks,Cocktails,Sexy Back,Passion and berries-infused beauty made with vodka fruity and vibrant,24
drinks,Cocktails,Cherry Kisses,Vodka-based raspberry cocktail sweet and berry-flavoured,26
drinks,Cocktails,Negroni,Campari sweet vermouth and gin a classic Italian bitter cocktail,25
drinks,Cocktails,Bay Breeze,Uganda waragi coconut with Smirnoff vodka a tropical cocktail,24
drinks,Cocktails,Amber Shades of Hickory,Fruit and booze combination a signature Hickory cocktail,24
drinks,Cocktails,Purple Dove,Vodka blue curacao cointreau and strawberries a colourful cocktail,24
drinks,Cocktails Pitcher,Hickory Ocean Breeze,Coconut rum blue curacao liqueur and lemonade served in a pitcher for sharing,70
drinks,Cocktails Pitcher,Strawberry Basil Fizz,Strawberries basil and lemonade served in a pitcher for groups,70
drinks,Cocktails Pitcher,Sangria Pitcher,Iced punch with fruit infusion and wine served in a pitcher,70
drinks,Cocktails Pitcher,Hickory Checkmate,Melon-flavoured with vodka rose wine and fresh fruits served in a pitcher,70
drinks,Softails Non-Alcoholic,Sweet Sun Rise,Tropical punch non-alcoholic refreshing fruit beverage,18
drinks,Softails Non-Alcoholic,Virgin Colada,Coconut refresher with pineapple juice a non-alcoholic pina colada,20
drinks,Softails Non-Alcoholic,Virgin Mojito,Non-alcoholic mojito with mint lime and soda refreshing and light,20
drinks,Softails Non-Alcoholic,Tropical Fruit Crash,Baristas choice tropical fruits blended with ice a refreshing non-alcoholic smoothie,18
drinks,Softails Non-Alcoholic,Minty Pineapple,Fresh pineapple juice and mint leaves a simple refreshing drink,15
drinks,Softails Non-Alcoholic,Green Detox,Avocado bananas mangoes celery and spinach smoothie a healthy non-alcoholic option,20
