source_page,category,item_name,description,price
drinks,Shooters,B52,Layered shooter cocktail with coffee liqueur Irish cream and Grand Marnier,10
drinks,Shooters,Blow Job,Sweet layered shooter with Irish cream and whipped cream,12
drinks,Shooters,Slippery Nipple,Smooth shooter with sambuca and Irish cream,10
drinks,Shooters,Jagerbomb,Jagermeister dropped into Red Bull an energizing shooter,15
wines,White Wines,Rooiberg Winery Chardonnay,Vibrant and elegant South African white wine with French oak leaves revealing pear-drop aromas,90
wines,White Wines,Herxheim Am Berg Sauvignon Blanc Trocken,German dry Sauvignon Blanc white wine crisp and refreshing,135
wines,White Wines,Hill and Dale Sauvignon Blanc,South African Sauvignon Blanc with fresh citrus and tropical notes,105
wines,White Wines,KWV Classic Collection Sauvignon Blanc,South African classic Sauvignon Blanc crisp and aromatic,90
wines,White Wines,Zonin Pinot Grigio Friuli Aquileia,Italian Pinot Grigio from Friuli light and refreshing white wine,105
wines,White Wines,Calvet Varietals Sauvignon Blanc,French Sauvignon Blanc with delicate floral and citrus notes,100
wines,White Wines,Nederburg Chardonnay,South African Chardonnay full-bodied and buttery,105
wines,White Wines,Zonin 20 Ventiterre Moscato,Italian Moscato sweet and aromatic sparkling white wine,120
wines,White Wines,Jacobs Creek Classic Chardonnay,Australian Chardonnay with ripe fruit and oak flavours,110
wines,White Wines,Landskroon Chardonnay,Premium South African Chardonnay complex and elegant,160
wines,White Wines,Simonsig Sunbird Sauvignon Blanc,South African Sauvignon Blanc with tropical fruit and citrus flavours,120
wines,Red Wines,Alvis Drift Merlot,South African Merlot smooth and medium-bodied red wine,130
wines,Red Wines,Eikendal Cabernet Sauvignon,Premium South African Cabernet Sauvignon full-bodied and rich,370
wines,Red Wines,Rooiberg Winery Cabernet Sauvignon,South African Cabernet Sauvignon with dark fruit and oak notes,90
wines,Red Wines,KWV Classic Collection Shiraz,South African Shiraz bold and spicy red wine,100
wines,Red Wines,Castello Di Albola Chianti Classico,Italian Chianti Classico from Tuscany a classic Italian red wine,210
wines,Red Wines,Zonin 20 Ventiterre Chianti,Italian Chianti medium-bodied with cherry and herb notes,110
wines,Red Wines,Caro Aruma Malbec,Argentinian Malbec by Catena and Rothschild full-bodied and rich,170
wines,Red Wines,Nederburg Winemaster Pinotage,South African Pinotage a unique grape variety with smoky berry flavours,130
wines,Red Wines,Jacobs Creek Double Barrel Shiraz,Australian Shiraz aged in whisky barrels for extra depth and complexity,210
wines,Red Wines,Calvet Varietals Cabernet Sauvignon,French Cabernet Sauvignon with blackcurrant and cedar notes,105
wines,Red Wines,Kumala Reserve Malbec,South African Malbec rich and fruity red wine,110
wines,Red Wines,Penfolds Koonunga Hill Cabernet Sauvignon,Australian Cabernet Sauvignon from the renowned Penfolds winery,200
wines,Sparkling Wines,Zonin Prosecco Cuvee 1821,Italian Prosecco sparkling wine light and celebratory,140
wines,Sparkling Wines,JP Chenet Blanc De Blancs Brut,French sparkling brut wine crisp and refreshing bubbles,110
wines,Sparkling Wines,Luc Belaire Luxe,Premium French sparkling wine luxurious and elegant,250
wines,Champagne,Moet and Chandon Imperial Brut,Premium French Champagne house classic Brut elegant and prestigious,480
wines,Champagne,Veuve Clicquot Brut,Iconic French Champagne known for its consistent quality and golden colour,580
wines,Champagne,Dom Perignon Brut,Prestigious vintage French Champagne the ultimate luxury celebration wine,1500
wines,Rose Wines,KWV Classic Collection Rose,South African Rose wine light and fruity pink wine,90
wines,Rose Wines,Nederburg Rose,South African Rose fresh and berry-flavoured,90
wines,Rose Wines,Exhib Cap Dagde Rose,French Rose wine from southern France dry and refreshing,90
cake,Cakes,Carrot Cake,Classic carrot cake with cream cheese frosting moist and spiced,120
cake,Cakes,Chocolate Cake,Rich chocolate cake with chocolate frosting a classic indulgent dessert,120
cake,Cakes,Coconut Cake,Moist coconut cake with coconut cream frosting tropical and sweet,120
cake,Cakes,Fruit Cake,Traditional fruit cake packed with dried fruits and nuts,140
cake,Cakes,Lemon Cake,Zesty lemon cake with lemon glaze refreshing citrus flavour,120
cake,Cakes,Strawberry Cake,Fresh strawberry cake with strawberry cream frosting light and fruity,120
cake,Cakes,Vanilla Cake,Classic vanilla sponge cake with vanilla buttercream frosting,120
cake,Cakes,Vanilla Cheesecake,Rich and creamy vanilla cheesecake with a biscuit base,160
cake,Cakes,Black Forest Cake,German chocolate and cherry cake with whipped cream layers,120
cake,Cakes,White Forest Cake,White chocolate and cherry cake with whipped cream a lighter version of Black Forest,120
cake,Cakes,Chocolate Fudge Cake,Dense and rich chocolate fudge cake with thick chocolate fudge frosting,140
cake,Cakes,Red Velvet Cake,Classic red velvet cake with cream cheese frosting moist and vibrant,120
cake,Cakes,White Chocolate Cake,Delicate white chocolate cake with white chocolate frosting elegant and sweet,120
reviews,customer_review_positive,,One of the best steaks I have ever had in Kampala and the fudgy dessert tasted fantastic definitely coming back,
reviews,customer_review_positive,,Great food excellent customer service and the environment is really romantic and breath taking,
reviews,customer_review_positive,,All the food was amazing and it tasted great the ambiance is perfect for a date night,
reviews,customer_review_positive,,Exceptional ambiance cleanliness and spacious layout the restaurant is incredibly inviting and well-maintained,
reviews,customer_review_positive,,Really charming restaurant and bar with swift polite and comfortable service,
reviews,customer_review_positive,,The staff are exceptional and extremely accommodating they made our dining experience memorable,
reviews,customer_review_positive,,Good selection of wines from South Africa Italy and France paired perfectly with the food,
reviews,customer_review_positive,,The cocktail menu is impressive with unique signature drinks like the Hickopolitan and Bulago Island Breeze,
reviews,customer_review_positive,,Perfect spot for family dinner and birthday celebrations the event hosting is wonderful,
reviews,customer_review_positive,,The garden setting is beautiful especially at night with great lighting and ambiance,
reviews,customer_review_negative,,The menu selection was extremely limited and not suitable for vegetarians very disappointed,
reviews,customer_review_negative,,Disappointed with the small amounts of food served for the price not good value,
reviews,customer_review_negative,,Very bad service lunch was delayed for an hour and a half unacceptable waiting time,
reviews,customer_review_negative,,Inconsistent service and parking challenges made the visit frustrating,
reviews,customer_review_positive,,The Hickory has become one of the top restaurants in Kampala their fusion cuisine is exceptional,
reviews,customer_review_positive,,Loved the Thai coconut curry and the grilled salmon both were perfectly cooked and seasoned,
reviews,customer_review_positive,,The wine list is extensive and well-curated with options from multiple countries and price ranges,
reviews,customer_review_positive,,Great value for money compared to other upscale restaurants in Kampala,
reviews,customer_review_positive,,The tiramisu and chocolate fondant are must-try desserts absolutely delicious,
reviews,customer_review_positive,,Beautiful interior design with a woody theme that creates a warm and cozy atmosphere,
reviews,customer_review_neutral,,Good food but the restaurant can get quite loud during peak hours on weekends,
reviews,customer_review_neutral,,The portions are decent but could be larger for the price point,
reviews,customer_review_positive,,The Lake Victoria fish burger is one of the best fish burgers in Kampala using fresh tilapia,
reviews,customer_review_positive,,Love the Hickory Carnival Platter perfect for sharing with a group of friends,
reviews,customer_review_negative,,Parking is very limited especially on weekends plan to arrive early or use a ride service,
reviews,customer_review_positive,,The Monthly Chefs Specials keep things interesting always something new to try,
reviews,customer_review_positive,,The breakfast menu is great and they open early at 8am perfect for morning meetings,
reviews,customer_review_positive,,The Nile perch fillet is a must-try showcasing the best of Ugandan local fish,
reviews,customer_review_positive,,Cocktail Oclock is a great experience with well-crafted drinks and a lively atmosphere,
reviews,customer_review_positive,,The pork ribs are fall-off-the-bone tender and the barbeque sauce is homemade perfection,
services,services_offered,,The Hickory offers dine-in services with indoor air-conditioned seating and outdoor garden seating,
services,services_offered,,Reservation services available for individuals groups and special events,
services,services_offered,,Event hosting and catering services for birthdays corporate events and celebrations,
services,services_offered,,Takeaway and food packaging services available for all menu items,
services,services_offered,,Free Wi-Fi available for all dining guests,
services,services_offered,,Disabled access and wheelchair-friendly facilities provided,
services,services_offered,,Full bar service with licensed premises for alcoholic beverages,
services,services_offered,,Cake ordering service with custom sizes available in 1kg 1.5kg and 2kg options,
services,services_offered,,Monthly Chef Specials featuring rotating seasonal dishes and new creations,
services,services_offered,,Cocktail Oclock signature experience with handcrafted cocktails and lounge atmosphere,
services,services_offered,,Open daily from 8am to 11pm seven days a week including public holidays,
services,services_offered,,Located in the upscale Kololo neighbourhood of Kampala near major hotels and embassies,
services,services_offered,,The restaurant is designed by Fortitude Solutions with a contemporary woody theme interior,
